temp_ablation.py --batch-size 64 --epochs 1 -lr 0.001 --dataset physionet2012 --n-gaussians 7 --flayers 3 --n-heads 2 --n-hidden 128 -ct 12 -ft 36 --fold 0
2025-11-20 17:32:41,033 - INFO - Arguments: Namespace(epochs=1, batch_size=64, val_batch_size=50, learn_rate=0.001, betas=[0.9, 0.999], weight_decay=0.001, seed=945661247, flayers=3, n_gaussians=7, n_heads=2, encoder='transformer', enc_layers=1, n_hiddens=128, dataset='physionet2012', forc_time=36, cond_time=12, nfolds=5, fold=0, bounds=20, num_bins=16, output_dir='saved_models', patience=30, scheduler_patience=10)
2025-11-20 17:32:41,034 - INFO - Starting training with experiment ID: 6361034
2025-11-20 17:32:41,034 - INFO - Using device: cuda
2025-11-20 17:32:41,049 - INFO - Available Models: {'NODE', 'TPA', 'SET-TS', 'BRITS', 'TFT', 'NCDE', 'Informer', 'Latent-ODE', 'ODE-RNN', 'IP-Net', 'mTAN', 'M-RNN', 'GRU-ODE-Bayes', 'N-BEATS'}
2025-11-20 17:32:41,049 - INFO - Available Datasets: {'Character Trajectories', 'Physionet 2019', 'Household Consumption', 'tourism1', 'M4', 'Air Quality Multi-Site', 'MuJoCo', 'UWAVE', 'Electricity', 'Traffic', 'M3', 'Physionet 2012', 'tourism2', 'Air Quality', 'M5', 'Human Activity', 'USHCN'}
2025-11-20 17:32:41,104 - INFO - Note: NumExpr detected 64 cores but "NUMEXPR_MAX_THREADS" not set, so enforcing safe limit of 8.
2025-11-20 17:32:41,104 - INFO - NumExpr defaulting to 8 threads.
2025-11-20 17:32:41,817 - WARNING - usetex mode requires TeX.
2025-11-20 17:32:41,896 - INFO - Adding keys as attributes.
2025-11-20 17:32:47,255 - INFO - Model initialized with 496191 parameters
================================================================================
Layer (type:depth-idx)                                  Param #
================================================================================
Moses                                                   --
├─ModuleList: 1-1                                       --
│    └─RationalLinearSplineFlow: 2-1                    --
│    │    └─Linear: 3-1                                 2,064
│    │    └─Linear: 3-2                                 2,064
│    │    └─Linear: 3-3                                 1,935
│    │    └─Linear: 3-4                                 2,064
│    └─RationalLinearSplineFlow: 2-2                    --
│    │    └─Linear: 3-5                                 2,064
│    │    └─Linear: 3-6                                 2,064
│    │    └─Linear: 3-7                                 1,935
│    │    └─Linear: 3-8                                 2,064
│    └─RationalLinearSplineFlow: 2-3                    --
│    │    └─Linear: 3-9                                 2,064
│    │    └─Linear: 3-10                                2,064
│    │    └─Linear: 3-11                                1,935
│    │    └─Linear: 3-12                                2,064
├─MultiGaussian: 1-2                                    --
│    └─Linear: 2-4                                      129
│    └─Linear: 2-5                                      16,512
├─MixtureWeights: 1-3                                   896
│    └─Linear: 2-6                                      129
├─TimeSeriesEncoder: 1-4                                --
│    └─Linear: 2-7                                      2
│    └─Linear: 2-8                                      254
│    └─Linear: 2-9                                      2
│    └─Linear: 2-10                                     254
│    └─Linear: 2-11                                     4,864
│    └─Linear: 2-12                                     4,864
│    └─Linear: 2-13                                     32,896
│    └─Linear: 2-14                                     33,024
│    └─ModuleList: 2-15                                 --
│    │    └─MultiHeadAttention: 3-13                    131,200
│    └─MultiHeadAttention: 2-16                         --
│    │    └─Linear: 3-14                                32,768
│    │    └─Linear: 3-15                                32,768
│    │    └─Linear: 3-16                                32,768
│    │    └─Linear: 3-17                                32,896
│    │    └─ScaledDotProductAttention: 3-18             --
│    └─Linear: 2-17                                     115,584
│    └─ReLU: 2-18                                       --
================================================================================
Total params: 496,191
Trainable params: 496,191
Non-trainable params: 0
================================================================================
2025-11-20 17:32:47,258 - INFO - Model summary:
================================================================================
Layer (type:depth-idx)                                  Param #
================================================================================
Moses                                                   --
├─ModuleList: 1-1                                       --
│    └─RationalLinearSplineFlow: 2-1                    --
│    │    └─Linear: 3-1                                 2,064
│    │    └─Linear: 3-2                                 2,064
│    │    └─Linear: 3-3                                 1,935
│    │    └─Linear: 3-4                                 2,064
│    └─RationalLinearSplineFlow: 2-2                    --
│    │    └─Linear: 3-5                                 2,064
│    │    └─Linear: 3-6                                 2,064
│    │    └─Linear: 3-7                                 1,935
│    │    └─Linear: 3-8                                 2,064
│    └─RationalLinearSplineFlow: 2-3                    --
│    │    └─Linear: 3-9                                 2,064
│    │    └─Linear: 3-10                                2,064
│    │    └─Linear: 3-11                                1,935
│    │    └─Linear: 3-12                                2,064
├─MultiGaussian: 1-2                                    --
│    └─Linear: 2-4                                      129
│    └─Linear: 2-5                                      16,512
├─MixtureWeights: 1-3                                   896
│    └─Linear: 2-6                                      129
├─TimeSeriesEncoder: 1-4                                --
│    └─Linear: 2-7                                      2
│    └─Linear: 2-8                                      254
│    └─Linear: 2-9                                      2
│    └─Linear: 2-10                                     254
│    └─Linear: 2-11                                     4,864
│    └─Linear: 2-12                                     4,864
│    └─Linear: 2-13                                     32,896
│    └─Linear: 2-14                                     33,024
│    └─ModuleList: 2-15                                 --
│    │    └─MultiHeadAttention: 3-13                    131,200
│    └─MultiHeadAttention: 2-16                         --
│    │    └─Linear: 3-14                                32,768
│    │    └─Linear: 3-15                                32,768
│    │    └─Linear: 3-16                                32,768
│    │    └─Linear: 3-17                                32,896
│    │    └─ScaledDotProductAttention: 3-18             --
│    └─Linear: 2-17                                     115,584
│    └─ReLU: 2-18                                       --
================================================================================
Total params: 496,191
Trainable params: 496,191
Non-trainable params: 0
================================================================================
2025-11-20 17:32:47,258 - INFO - Starting training loop...
epoch_time: 8.207944393157959
Initial memory: 1.90 MB
Current memory: 575.06 MB
Peak memory: 3646.21 MB
min queries: 1.0
mx queries: 459.0
