temp_ablation.py --batch-size 64 --epochs 1 -lr 0.001 --dataset physionet2012 --n-gaussians 1 --flayers 3 --n-heads 2 --n-hidden 128 -ct 12 -ft 36 --fold 0
2025-11-20 17:33:05,023 - INFO - Arguments: Namespace(epochs=1, batch_size=64, val_batch_size=50, learn_rate=0.001, betas=[0.9, 0.999], weight_decay=0.001, seed=1354403238, flayers=3, n_gaussians=1, n_heads=2, encoder='transformer', enc_layers=1, n_hiddens=128, dataset='physionet2012', forc_time=36, cond_time=12, nfolds=5, fold=0, bounds=20, num_bins=16, output_dir='saved_models', patience=30, scheduler_patience=10)
2025-11-20 17:33:05,024 - INFO - Starting training with experiment ID: 6385024
2025-11-20 17:33:05,024 - INFO - Using device: cuda
2025-11-20 17:33:05,039 - INFO - Available Models: {'Informer', 'GRU-ODE-Bayes', 'M-RNN', 'TPA', 'IP-Net', 'Latent-ODE', 'ODE-RNN', 'BRITS', 'mTAN', 'TFT', 'NCDE', 'SET-TS', 'N-BEATS', 'NODE'}
2025-11-20 17:33:05,039 - INFO - Available Datasets: {'Air Quality Multi-Site', 'M3', 'Household Consumption', 'Electricity', 'USHCN', 'M5', 'tourism1', 'tourism2', 'Traffic', 'M4', 'Air Quality', 'UWAVE', 'MuJoCo', 'Physionet 2012', 'Character Trajectories', 'Physionet 2019', 'Human Activity'}
2025-11-20 17:33:05,093 - INFO - Note: NumExpr detected 64 cores but "NUMEXPR_MAX_THREADS" not set, so enforcing safe limit of 8.
2025-11-20 17:33:05,094 - INFO - NumExpr defaulting to 8 threads.
2025-11-20 17:33:05,797 - WARNING - usetex mode requires TeX.
2025-11-20 17:33:05,876 - INFO - Adding keys as attributes.
2025-11-20 17:33:11,177 - INFO - Model initialized with 396351 parameters
================================================================================
Layer (type:depth-idx)                                  Param #
================================================================================
Moses                                                   --
├─ModuleList: 1-1                                       --
│    └─RationalLinearSplineFlow: 2-1                    --
│    │    └─Linear: 3-1                                 2,064
│    │    └─Linear: 3-2                                 2,064
│    │    └─Linear: 3-3                                 1,935
│    │    └─Linear: 3-4                                 2,064
│    └─RationalLinearSplineFlow: 2-2                    --
│    │    └─Linear: 3-5                                 2,064
│    │    └─Linear: 3-6                                 2,064
│    │    └─Linear: 3-7                                 1,935
│    │    └─Linear: 3-8                                 2,064
│    └─RationalLinearSplineFlow: 2-3                    --
│    │    └─Linear: 3-9                                 2,064
│    │    └─Linear: 3-10                                2,064
│    │    └─Linear: 3-11                                1,935
│    │    └─Linear: 3-12                                2,064
├─MultiGaussian: 1-2                                    --
│    └─Linear: 2-4                                      129
│    └─Linear: 2-5                                      16,512
├─MixtureWeights: 1-3                                   128
│    └─Linear: 2-6                                      129
├─TimeSeriesEncoder: 1-4                                --
│    └─Linear: 2-7                                      2
│    └─Linear: 2-8                                      254
│    └─Linear: 2-9                                      2
│    └─Linear: 2-10                                     254
│    └─Linear: 2-11                                     4,864
│    └─Linear: 2-12                                     4,864
│    └─Linear: 2-13                                     32,896
│    └─Linear: 2-14                                     33,024
│    └─ModuleList: 2-15                                 --
│    │    └─MultiHeadAttention: 3-13                    131,200
│    └─MultiHeadAttention: 2-16                         --
│    │    └─Linear: 3-14                                32,768
│    │    └─Linear: 3-15                                32,768
│    │    └─Linear: 3-16                                32,768
│    │    └─Linear: 3-17                                32,896
│    │    └─ScaledDotProductAttention: 3-18             --
│    └─Linear: 2-17                                     16,512
│    └─ReLU: 2-18                                       --
================================================================================
Total params: 396,351
Trainable params: 396,351
Non-trainable params: 0
================================================================================
2025-11-20 17:33:11,179 - INFO - Model summary:
================================================================================
Layer (type:depth-idx)                                  Param #
================================================================================
Moses                                                   --
├─ModuleList: 1-1                                       --
│    └─RationalLinearSplineFlow: 2-1                    --
│    │    └─Linear: 3-1                                 2,064
│    │    └─Linear: 3-2                                 2,064
│    │    └─Linear: 3-3                                 1,935
│    │    └─Linear: 3-4                                 2,064
│    └─RationalLinearSplineFlow: 2-2                    --
│    │    └─Linear: 3-5                                 2,064
│    │    └─Linear: 3-6                                 2,064
│    │    └─Linear: 3-7                                 1,935
│    │    └─Linear: 3-8                                 2,064
│    └─RationalLinearSplineFlow: 2-3                    --
│    │    └─Linear: 3-9                                 2,064
│    │    └─Linear: 3-10                                2,064
│    │    └─Linear: 3-11                                1,935
│    │    └─Linear: 3-12                                2,064
├─MultiGaussian: 1-2                                    --
│    └─Linear: 2-4                                      129
│    └─Linear: 2-5                                      16,512
├─MixtureWeights: 1-3                                   128
│    └─Linear: 2-6                                      129
├─TimeSeriesEncoder: 1-4                                --
│    └─Linear: 2-7                                      2
│    └─Linear: 2-8                                      254
│    └─Linear: 2-9                                      2
│    └─Linear: 2-10                                     254
│    └─Linear: 2-11                                     4,864
│    └─Linear: 2-12                                     4,864
│    └─Linear: 2-13                                     32,896
│    └─Linear: 2-14                                     33,024
│    └─ModuleList: 2-15                                 --
│    │    └─MultiHeadAttention: 3-13                    131,200
│    └─MultiHeadAttention: 2-16                         --
│    │    └─Linear: 3-14                                32,768
│    │    └─Linear: 3-15                                32,768
│    │    └─Linear: 3-16                                32,768
│    │    └─Linear: 3-17                                32,896
│    │    └─ScaledDotProductAttention: 3-18             --
│    └─Linear: 2-17                                     16,512
│    └─ReLU: 2-18                                       --
================================================================================
Total params: 396,351
Trainable params: 396,351
Non-trainable params: 0
================================================================================
2025-11-20 17:33:11,180 - INFO - Starting training loop...
epoch_time: 5.489653587341309
Initial memory: 1.52 MB
Current memory: 99.38 MB
Peak memory: 616.74 MB
min queries: 1.0
mx queries: 459.0
