temp_ablation.py --batch-size 64 --epochs 1 -lr 0.001 --dataset physionet2012 --n-gaussians 10 --flayers 3 --n-heads 2 --n-hidden 128 -ct 12 -ft 36 --fold 0
2025-11-20 17:32:31,530 - INFO - Arguments: Namespace(epochs=1, batch_size=64, val_batch_size=50, learn_rate=0.001, betas=[0.9, 0.999], weight_decay=0.001, seed=1557087695, flayers=3, n_gaussians=10, n_heads=2, encoder='transformer', enc_layers=1, n_hiddens=128, dataset='physionet2012', forc_time=36, cond_time=12, nfolds=5, fold=0, bounds=20, num_bins=16, output_dir='saved_models', patience=30, scheduler_patience=10)
2025-11-20 17:32:31,530 - INFO - Starting training with experiment ID: 6351530
2025-11-20 17:32:31,530 - INFO - Using device: cuda
2025-11-20 17:32:31,547 - INFO - Available Models: {'SET-TS', 'ODE-RNN', 'NCDE', 'TPA', 'Informer', 'NODE', 'BRITS', 'IP-Net', 'mTAN', 'N-BEATS', 'Latent-ODE', 'GRU-ODE-Bayes', 'M-RNN', 'TFT'}
2025-11-20 17:32:31,548 - INFO - Available Datasets: {'Human Activity', 'Character Trajectories', 'M5', 'M4', 'UWAVE', 'Traffic', 'tourism2', 'Physionet 2019', 'Air Quality', 'Household Consumption', 'M3', 'Physionet 2012', 'Air Quality Multi-Site', 'MuJoCo', 'tourism1', 'Electricity', 'USHCN'}
2025-11-20 17:32:31,611 - INFO - Note: NumExpr detected 64 cores but "NUMEXPR_MAX_THREADS" not set, so enforcing safe limit of 8.
2025-11-20 17:32:31,612 - INFO - NumExpr defaulting to 8 threads.
2025-11-20 17:32:32,380 - WARNING - usetex mode requires TeX.
2025-11-20 17:32:32,460 - INFO - Adding keys as attributes.
2025-11-20 17:32:37,753 - INFO - Model initialized with 546111 parameters
================================================================================
Layer (type:depth-idx)                                  Param #
================================================================================
Moses                                                   --
├─ModuleList: 1-1                                       --
│    └─RationalLinearSplineFlow: 2-1                    --
│    │    └─Linear: 3-1                                 2,064
│    │    └─Linear: 3-2                                 2,064
│    │    └─Linear: 3-3                                 1,935
│    │    └─Linear: 3-4                                 2,064
│    └─RationalLinearSplineFlow: 2-2                    --
│    │    └─Linear: 3-5                                 2,064
│    │    └─Linear: 3-6                                 2,064
│    │    └─Linear: 3-7                                 1,935
│    │    └─Linear: 3-8                                 2,064
│    └─RationalLinearSplineFlow: 2-3                    --
│    │    └─Linear: 3-9                                 2,064
│    │    └─Linear: 3-10                                2,064
│    │    └─Linear: 3-11                                1,935
│    │    └─Linear: 3-12                                2,064
├─MultiGaussian: 1-2                                    --
│    └─Linear: 2-4                                      129
│    └─Linear: 2-5                                      16,512
├─MixtureWeights: 1-3                                   1,280
│    └─Linear: 2-6                                      129
├─TimeSeriesEncoder: 1-4                                --
│    └─Linear: 2-7                                      2
│    └─Linear: 2-8                                      254
│    └─Linear: 2-9                                      2
│    └─Linear: 2-10                                     254
│    └─Linear: 2-11                                     4,864
│    └─Linear: 2-12                                     4,864
│    └─Linear: 2-13                                     32,896
│    └─Linear: 2-14                                     33,024
│    └─ModuleList: 2-15                                 --
│    │    └─MultiHeadAttention: 3-13                    131,200
│    └─MultiHeadAttention: 2-16                         --
│    │    └─Linear: 3-14                                32,768
│    │    └─Linear: 3-15                                32,768
│    │    └─Linear: 3-16                                32,768
│    │    └─Linear: 3-17                                32,896
│    │    └─ScaledDotProductAttention: 3-18             --
│    └─Linear: 2-17                                     165,120
│    └─ReLU: 2-18                                       --
================================================================================
Total params: 546,111
Trainable params: 546,111
Non-trainable params: 0
================================================================================
2025-11-20 17:32:37,756 - INFO - Model summary:
================================================================================
Layer (type:depth-idx)                                  Param #
================================================================================
Moses                                                   --
├─ModuleList: 1-1                                       --
│    └─RationalLinearSplineFlow: 2-1                    --
│    │    └─Linear: 3-1                                 2,064
│    │    └─Linear: 3-2                                 2,064
│    │    └─Linear: 3-3                                 1,935
│    │    └─Linear: 3-4                                 2,064
│    └─RationalLinearSplineFlow: 2-2                    --
│    │    └─Linear: 3-5                                 2,064
│    │    └─Linear: 3-6                                 2,064
│    │    └─Linear: 3-7                                 1,935
│    │    └─Linear: 3-8                                 2,064
│    └─RationalLinearSplineFlow: 2-3                    --
│    │    └─Linear: 3-9                                 2,064
│    │    └─Linear: 3-10                                2,064
│    │    └─Linear: 3-11                                1,935
│    │    └─Linear: 3-12                                2,064
├─MultiGaussian: 1-2                                    --
│    └─Linear: 2-4                                      129
│    └─Linear: 2-5                                      16,512
├─MixtureWeights: 1-3                                   1,280
│    └─Linear: 2-6                                      129
├─TimeSeriesEncoder: 1-4                                --
│    └─Linear: 2-7                                      2
│    └─Linear: 2-8                                      254
│    └─Linear: 2-9                                      2
│    └─Linear: 2-10                                     254
│    └─Linear: 2-11                                     4,864
│    └─Linear: 2-12                                     4,864
│    └─Linear: 2-13                                     32,896
│    └─Linear: 2-14                                     33,024
│    └─ModuleList: 2-15                                 --
│    │    └─MultiHeadAttention: 3-13                    131,200
│    └─MultiHeadAttention: 2-16                         --
│    │    └─Linear: 3-14                                32,768
│    │    └─Linear: 3-15                                32,768
│    │    └─Linear: 3-16                                32,768
│    │    └─Linear: 3-17                                32,896
│    │    └─ScaledDotProductAttention: 3-18             --
│    └─Linear: 2-17                                     165,120
│    └─ReLU: 2-18                                       --
================================================================================
Total params: 546,111
Trainable params: 546,111
Non-trainable params: 0
================================================================================
2025-11-20 17:32:37,756 - INFO - Starting training loop...
epoch_time: 10.024543285369873
Initial memory: 2.09 MB
Current memory: 788.00 MB
Peak memory: 5017.25 MB
min queries: 1.0
mx queries: 459.0
